{"$schema":"https://json-schema.org/draft/2020-12/schema","type":"object","required":["anonymous_semantic_id","gates","all_passed","supporting_trace_hash","certification_seed"],"properties":{"anonymous_semantic_id":{"type":"string"},"gates":{"type":"object","minProperties":15,"additionalProperties":{"type":"object","required":["passed","value","threshold","supporting_cases"],"properties":{"passed":{"type":"boolean"},"value":{"type":"number"},"threshold":{"type":"string"},"supporting_cases":{"type":"array","items":{"type":"string"}}},"additionalProperties":false}},"all_passed":{"type":"boolean"},"supporting_trace_hash":{"type":"string"},"certification_seed":{"type":"integer"}},"additionalProperties":false}

